<?xml version="1.0" encoding="UTF-8"?>
<registro_temperatura
    xmlns:xs="http://www.w3.org/2001/XMLSchema-instance"
    xs:noNamespaceSchemaLocation="registro_temperatura.xsd">
    <provincia>Madrid</provincia>
    <fecha>2004-03-11</fecha>
    <temperatura_minima>-5</temperatura_minima>
    <temperatura_maxima>4</temperatura_maxima>
    <incidencias>
        <incidencia nombre="frio" severidad="alta"/>
        <incidencia nombre="nieve" severidad="alta"/>
        <incidencia nombre="lluvia" severidad="media"/>
    </incidencias>
</registro_temperatura>